{
  "$schema": "./roadmap.schema.json",
  "title": "My Project",
  "subtitle": "one-line description of what you're building · source of truth: ROADMAP.md",
  "loop": "Optional narrative line — the core loop, the wedge, or the rule your product runs on.",
  "columns": [
    { "id": "now", "label": "Now", "color": "#4ade80" },
    { "id": "next", "label": "Next", "color": "#60a5fa" },
    { "id": "later", "label": "Later", "color": "#c084fc" }
  ],
  "tiers": [
    { "id": "rock", "label": "Rocks · foundational & risky", "color": "#f59e0b" },
    { "id": "pebble", "label": "Pebbles · features", "color": "#60a5fa" },
    { "id": "sand", "label": "Sand · glue & polish", "color": "#4ade80" }
  ],
  "tracks": [
    { "id": "core", "label": "Core", "color": "#2dd4bf", "border": "#164a44", "bg": "#06140f" },
    { "id": "ui", "label": "UI", "color": "#60a5fa", "border": "#1e3a5c", "bg": "#0a1320" },
    { "id": "platform", "label": "Platform", "color": "#7a8898", "border": "#2a323e", "bg": "#10141b" }
  ],
  "launches": [
    { "id": "v1", "label": "v1 — launch" },
    { "id": "v2", "label": "v2 — later" }
  ],
  "models": [],
  "cards": [
    {
      "id": "R1",
      "title": "The first foundational thing",
      "column": "now",
      "tier": "rock",
      "track": "core",
      "size": "L",
      "launch": "v1",
      "blocker": true,
      "summary": "What this slice does, in 1–2 sentences. Rocks are the load-bearing, risky, or must-be-right work that everything else depends on.",
      "done": "A concrete, testable definition of done for this slice.",
      "closes": "closes RISK-1 · GAP-2"
    },
    {
      "id": "P1",
      "title": "A user-facing feature",
      "column": "next",
      "tier": "pebble",
      "track": "ui",
      "size": "M",
      "launch": "v1",
      "summary": "Pebbles are real features users touch. Keep summaries dense — one screen of value per card.",
      "done": "What the user can do when this is finished."
    },
    {
      "id": "S1",
      "title": "Some glue or polish",
      "column": "later",
      "tier": "sand",
      "track": "platform",
      "size": "S",
      "launch": "v2",
      "summary": "Sand fills the gaps: config, tests, small fixes, polish. Cheap, deferrable, not load-bearing.",
      "gated": true
    }
  ],
  "shipped": [
    {
      "id": "R0",
      "title": "Something already done",
      "track": "platform",
      "size": "M",
      "launch": "v1",
      "summary": "Shipped cards appear in a collapsed section at the bottom, dimmed. Move a card here when it lands.",
      "done": "What proved it was done.",
      "shipped": "2026-01-01"
    }
  ]
}
